{"affected_surface":[{"identifier":"Vault.donate","kind":"function"}],"budget":{},"constraints":{"symbolic_budget":40},"depth":"standard","discover_surface":false,"expected_output":[],"hypothesis":"","prior_evidence":[{"claim":"relation holds on deposit","evidence_id":"E1","polarity":"supports","provenance":{"producer":"crystal","revision":"57fb317"}}],"provenance":{"asked_by":"build-020-fixture"},"question":"Does the assets/shares relation survive the donate path?","question_id":"f6ff9f0dd2e7d13f7c0ee78684b35c47","required_capabilities":["static","symbolic"],"schema_version":"1.0","source_snapshot":{"revision":"57fb317","tree_digest":"576929de"},"target":{"target_id":"lido/stonks@1"}}